feature_id,h1,h2,feature_description,version
26786,Drivers,"TV tuners, webcams, video capturers",atmel: atmel-isc-base: expose white balance as v4l2 controls,5.7
19151,Drivers,Networking,cxgb4 Add support for RDMA enhancements,4.17
39299,Architectures,X86,iommu/amd: Add 5 level guest page table support,6.4
39096,File systems,EROFS,Support flattened block device for multi-blob images,6.4
36915,Block layer,,sed-opal: Add ioctl to return device status,6.1
44250,Drivers,Networking,ti: icssg-prueth: Add multicast filtering support,6.11
17922,Drivers,Networking,rtlwifi Add module parameter ASPM,4.15
44776,Drivers,Graphics,msm adreno: Add A615 GPU for SDM670 and Pixel 3a,6.12
11371,Drivers,Networking,Bluetooth hci_uart: Add basic support for Intel Lightning Peak devices,4.3
26926,Drivers,Clock,mmp2: Add support for PLL clock sources,5.7
4967,Architecture-specific changes,,ARM Latencytop support,2.6.27
33201,"Tracing, perf and BPF",,BPF Add support for new btf kind . The new attribute can also be used for bpf programs e.g. tagging with  attributes for function parameters specifying global function preconditions etc. Such information may help verifier to detect user program bugs,5.16
27727,Drivers,Leds,Add aw2013 driver,5.8
22337,Drivers,Audio,ASoC sprd: Add Spreadtrum audio DMA platfrom driver,5.1
17794,Drivers,Graphics,sii8620 Add remote control support,4.15
35770,Drivers,Thunderbolt,Add support for XDomain lane bonding,5.19
27854,File systems,,Btrfs Start deprecation of mount option inode_cache,5.9
9206,Networking,,NFC HCI support,3.5
28973,Drivers,Networking,dpaa2 dpaa2-eth: add devlink parser error drop trap support,5.10
18344,Architectures,,platforms Add driver for GPD pocket custom fan controller,4.16
17278,Drivers,Audio,ASoC Intel: kbl: Add Multi-Playback & Echo-reference,4.14
30890,Core (various),,Task scheduler Move SCHED_DEBUG sysctl to debugfs,5.13
32514,File systems,,"NFS Allow for new mounts that are to the same server (ie nfsv4.1+ session trunkable servers) but different network addresses to use connections associated with those mounts but still use the same client structure. A new mount options ""max_connect"" controls how many extra transports can be added to an existing client with maximum of 16 such transports",5.15
27809,Drivers,Various,remoteproc: Add PAS and MSA based Modem support,5.8
9249,Networking,,Add interface option to enable routing of 127.0.0.0/8,3.6
1193,Drivers & architectures,,Intel thermal monitor for x86_64,2.6.11
4294,Subsystems,Architecture-specific changes,POWERPC pasemi: Implement MSI support.,2.6.25
5959,Drivers,Network,broadcom: Add support for BCM50610  add flow control support,2.6.29
31513,Drivers,"Tablets, touch screens, keyboards, mouses",HID Add support for Surface Aggregator Module HID transport,5.13
44181,Drivers,Networking,fbnic: Add network driver for Meta Platforms Host Network Interface,6.11
12577,Virtualization,,virtio: add noring tool useful to measure testing framework overhead,4.7
43346,Drivers,Drivers in the Staging area,atomisp: Further media-controller related fixes + dead code removal,6.10
33225,Cryptography,,engine: Add KPP Support to Crypto Engine,5.16
28444,Drivers,Audio,ASoC: Intel: common: add match table for TGL MAX98373 + RT5682 SoundWire driver,5.9
37467,Drivers,Clock,qcom apss-ipq-pll: add support for IPQ8074,6.1
19047,Architectures,,S390 Add a sysfs attribute to control the IFCC handling in case of constant channel errors,4.17
39674,Drivers,Various,Add SCMI support for mailbox unidirectional channels,6.4
28168,Networking,,"Adds a ""strict mode"" to the Virtual Routing and Forwarding infrastructure (VRF). It imposes that each VRF can be associated to a routing table only if such routing table is not already in use by any other VRF. The strict mode feature is designed to be network-namespace aware and it can be directly enabled/disabled acting on the ""strict_mode"" parameter",5.9
44407,Drivers,"PHY (""physical layer"" framework)",Add initial USB support for the Renesas RZ/G3S !SoC,6.12
37190,Drivers,Networking,igc: add xdp frags support to ndo_xdp_xmit,6.1
